{"$schema":"https://json-schema.org/draft/2020-12/schema","$id":"https://capinsta.dev/contracts/clip-project-v1.schema.json","title":"ClipProjectV1","type":"object","additionalProperties":false,"required":["schemaVersion","clipProjectId","workspaceId","name","sourceMedia","transcriptId","transcriptRevision","ranges","canvas","captionTrack","settings","status","revision","metadata","createdAt","updatedAt"],"properties":{"schemaVersion":{"const":1},"clipProjectId":{"type":"string","minLength":1},"workspaceId":{"type":["string","null"]},"name":{"type":"string"},"sourceMedia":{"type":"object"},"transcriptId":{"type":["string","null"]},"transcriptRevision":{"type":["integer","null"],"minimum":1},"ranges":{"type":"array","items":{"$ref":"clip-range-v1.schema.json"}},"canvas":{"type":"object"},"captionTrack":{"type":["object","null"]},"settings":{"type":"object"},"status":{"type":"string"},"revision":{"type":"integer","minimum":1},"metadata":{"type":"object"},"createdAt":{"type":"string","format":"date-time"},"updatedAt":{"type":"string","format":"date-time"}}}
