{"schemaVersion":1,"clipProjectId":"clip_empty","workspaceId":null,"name":"Empty","sourceMedia":{"mediaId":"media_001","durationMs":0,"sourceType":"unknown","displayName":null,"mimeType":null,"storageKey":null,"checksum":null,"metadata":{}},"transcriptId":null,"transcriptRevision":null,"ranges":[],"canvas":{"aspectRatio":"1:1","width":1080,"height":1080,"background":null,"safeArea":null,"metadata":{}},"captionTrack":null,"settings":{"defaultPreRollMs":0,"defaultPostRollMs":0,"snapToWords":true,"snapToSegments":true,"preserveBreathingRoom":true,"metadata":{}},"status":"draft","revision":1,"metadata":{},"createdAt":"2026-07-24T12:00:00Z","updatedAt":"2026-07-24T12:00:00Z"}
