{"schemaVersion":1,"clipProjectId":"clip_project_001","workspaceId":null,"name":"Synthetic clip","sourceMedia":{"mediaId":"media_001","durationMs":60000,"sourceType":"uploaded","displayName":"sample.mp4","mimeType":"video/mp4","storageKey":null,"checksum":null,"metadata":{}},"transcriptId":"tr_english","transcriptRevision":1,"ranges":[{"schemaVersion":1,"id":"range_001","sourceMediaId":"media_001","sourceStartMs":12000,"sourceEndMs":31000,"order":0,"playbackRate":1,"selection":{"transcriptId":"tr_english","transcriptRevision":1,"startWordId":null,"endWordId":null,"startSegmentId":null,"endSegmentId":null},"boundary":{"preRollMs":100,"postRollMs":150,"startAdjustedManually":false,"endAdjustedManually":false},"transitionIn":null,"transitionOut":null,"enabled":true,"label":null,"metadata":{}}],"canvas":{"aspectRatio":"9:16","width":1080,"height":1920,"background":null,"safeArea":null,"metadata":{}},"captionTrack":null,"settings":{"defaultPreRollMs":100,"defaultPostRollMs":150,"snapToWords":true,"snapToSegments":true,"preserveBreathingRoom":true,"metadata":{}},"status":"draft","revision":1,"metadata":{"synthetic":true},"createdAt":"2026-07-24T12:00:00Z","updatedAt":"2026-07-24T12:00:00Z"}
